[
  {
    "id": "configmap",
    "glossary_id": "configmap",
    "english": "ConfigMap",
    "translate": true,
    "translation": "컨피그맵(ConfigMap)",
    "definition": {
      "english": "An API object used to store non-confidential data in key-value pairs. Can be consumed as environment variables, command-line arguments, or configuration files in a volume.",
      "translation": "키-값 쌍으로 기밀이 아닌 데이터를 저장하는 데 사용하는 API 오브젝트이다. 볼륨에서 환경 변수, 커맨드-라인 인수 또는 구성 파일로 사용될 수 있다."
    },
    "translation_sample": "컨피그맵을 사용하면 컨테이너 이미지에서 환경별 구성을 분리하여, 애플리케이션을 쉽게 이식할 수 있다.",
    "notes": "API 오브젝트인 경우"
  },
  {
    "id": "cron-job",
    "glossary_id": "cronjob",
    "english": "cron job",
    "translate": true,
    "translation": "크론 잡",
    "definition": {
      "english": "A repeating task (a Job) that runs on a regular schedule.",
      "translation": "정기적인 일정으로 실행되는 반복 작업(잡)."
    },
    "translation_sample": "*crontab* 파일의 라인과 유사하게, 크론잡 오브젝트는 [크론](https://ko.wikipedia.org/wiki/Cron) 형식을 사용하여 일정을 지정한다."
  },
  {
    "id": "cronjob",
    "glossary_id": "cronjob",
    "english": "CronJob",
    "translate": true,
    "translation": "크론잡(CronJob)",
    "definition": {
      "english": "A repeating task (a Job) that runs on a regular schedule.",
      "translation": "정기적인 일정으로 실행되는 반복 작업(잡)."
    },
    "translation_sample": "*crontab* 파일의 라인과 유사하게, 크론잡 오브젝트는 [크론](https://ko.wikipedia.org/wiki/Cron) 형식을 사용하여 일정을 지정한다.",
    "notes": "API 오브젝트인 경우"
  },
  {
    "id": "event",
    "glossary_id": "event",
    "english": "Event",
    "translate": true,
    "translation": "이벤트(Event)",
    "definition": {
      "english": "Kubernetes objects that describe some state change in the cluster.",
      "translation": "클러스터 어딘가에서 발생한 이벤트에 대한 보고서이다. 일반적으로 시스템의 상태 변화를 나타낸다."
    },
    "translation_sample": "이벤트의 보존(retention) 시간은 제한되어 있으며, 트리거(trigger)와 메시지(message)는 시간에 따라 변화할 수 있다.",
    "notes": "API 오브젝트인 경우"
  },
  {
    "id": "limitrange",
    "glossary_id": "limitrange",
    "english": "LimitRange",
    "translate": true,
    "translation": "리밋레인지(LimitRange)",
    "definition": {
      "english": "Provides constraints to limit resource consumption per Containers or Pods in a namespace.",
      "translation": "네임스페이스 내에 컨테이너나 파드당 리소스 소비를 한정하는 제약 조건을 제공한다."
    },
    "translation_sample": "범위 제한은 타입별로 만들 수 있는 오브젝트의 개수와 네임스페이스 안에 개별 컨테이너나 파드가 요청하거나 소비할 컴퓨팅 리소스의 양을 제한한다.",
    "notes": "API 오브젝트인 경우"
  },
  {
    "id": "pod",
    "glossary_id": "pod",
    "english": "Pod",
    "translate": true,
    "translation": "파드",
    "definition": {
      "english": "A Pod represents a set of running containers in your cluster.",
      "translation": "파드는 클러스터에서 실행 중인 컨테이너의 집합을 나타낸다."
    },
    "translation_sample": "파드는 일반적으로 하나의 기본 컨테이너를 실행하기 위해서 구성된다.",
    "notes": "API 오브젝트인 경우에도 표현의 간결함을 위해 한영병기를 하지 않음"
  },
  {
    "id": "qos-class",
    "glossary_id": "qos-class",
    "english": "QoS class",
    "translate": true,
    "translation": "QoS 클래스",
    "definition": {
      "english": "QoS Class (Quality of Service Class) provides a way for Kubernetes to classify pods within the cluster into several classes and make decisions about scheduling and eviction.",
      "translation": "QoS 클래스(서비스 품질 클래스)는 쿠버네티스가 클러스터 안의 파드들을 여러 클래스로 구분하고, 스케줄링과 축출(eviction)에 대한 결정을 내리는 방법을 제공한다."
    },
    "translation_sample": "파드의 QoS 클래스는 생성 시점의 컴퓨팅 리소스 요청량과 제한 값에 기반해서 설정된다."
  },
  {
    "id": "secret",
    "glossary_id": "secret",
    "english": "Secret",
    "translate": true,
    "translation": "시크릿(Secret)",
    "definition": {
      "english": "Stores sensitive information, such as passwords, OAuth tokens, and ssh keys.",
      "translation": "비밀번호, OAuth 토큰 및 SSH 키와 같은 민감한 정보를 저장한다."
    },
    "translation_sample": "시크릿을 사용하면 민감한 정보가 사용되는 방법을 더 잘 통제할 수 있으며, 실수로 외부에 노출되는 위험도 줄일 수 있다.",
    "notes": "API 오브젝트인 경우"
  },
  {
    "id": "taint",
    "glossary_id": "taint",
    "english": "taint",
    "translate": true,
    "translation": "테인트(taint)",
    "definition": {
      "english": "A core object consisting of three required properties: key, value, and effect. Taints prevent the scheduling of pods on nodes or node groups.",
      "translation": "세 가지 필수 속성: 키(key), 값(value), 효과(effect)로 구성된 코어 오브젝트. 테인트는 파드가 노드나 노드 그룹에 스케줄링되는 것을 방지한다."
    },
    "translation_sample": "테인트 및 톨러레이션(toleration)은 함께 작동하며, 파드가 적절하지 못한 노드에 스케줄되는 것을 방지한다."
  },
  {
    "id": "volume",
    "glossary_id": "volume",
    "english": "volume",
    "translate": true,
    "translation": "볼륨",
    "definition": {
      "english": "A directory containing data, accessible to the containers in a pod.",
      "translation": "데이터를 포함하고 있는 디렉터리이며, 파드의 컨테이너에서 접근 가능하다."
    },
    "translation_sample": "쿠버네티스 볼륨은 그것을 포함하고 있는 파드만큼 오래 산다."
  }
]
