[
  {
    "id": "cidr",
    "glossary_id": "cidr",
    "english": "CIDR",
    "translate": false,
    "translation": null,
    "definition": {
      "english": "CIDR is a notation for describing blocks of IP addresses and is used heavily in various networking configurations.",
      "translation": "CIDRは、IPアドレスの範囲を記述するための表記法であり、さまざまなネットワークを構成するために使用されています。"
    },
    "translation_sample": "PodネットワークとServiceネットワークに適切なCIDRブロックを割り当てます。"
  },
  {
    "id": "cni",
    "glossary_id": "cni",
    "english": "Container network interface (CNI)",
    "translate": true,
    "translation": "コンテナネットワークインターフェース(CNI)",
    "definition": {
      "english": "Container network interface (CNI) plugins are a type of Network plugin that adheres to the appc/CNI specification.",
      "translation": "コンテナネットワークインターフェース(CNI)プラグインは、appc/CNI仕様に準拠したネットワークプラグインの一種です。"
    },
    "translation_sample": "クラスターにCNIプラグインをインストールしてPod間通信を構成します。"
  },
  {
    "id": "endpoint-slice",
    "glossary_id": "endpoint-slice",
    "english": "EndpointSlice",
    "translate": false,
    "translation": null,
    "definition": {
      "english": "EndpointSlices track the IP addresses of Pods for Services.",
      "translation": "EndpointSliceはServiceに対応するPodのIPアドレスを追跡します。"
    },
    "translation_sample": "EndpointSliceは大量のエンドポイントを持つServiceのスケーラビリティを向上させます。"
  },
  {
    "id": "endpoints",
    "glossary_id": "endpoints",
    "english": "Endpoints",
    "translate": true,
    "translation": "エンドポイント（Endpoints）",
    "definition": {
      "english": "(Deprecated) API representing endpoints of a Service",
      "translation": "エンドポイントは、サービスのセレクターに一致するPodのIPアドレスを記録する責任があります。"
    },
    "translation_sample": "エンドポイント（Endpoints）オブジェクトがServiceの転送先Pod一覧を保持します。"
  },
  {
    "id": "gateway-api",
    "glossary_id": "gateway-api",
    "english": "Gateway API",
    "translate": false,
    "translation": null,
    "definition": {
      "english": "An API for modeling service networking in Kubernetes.",
      "translation": "Kubernetesでサービスネットワークをモデル化するために使用されるAPI。"
    },
    "translation_sample": "Gateway APIを使用して高度なルーティングとトラフィック管理を実装します。"
  },
  {
    "id": "ingress",
    "glossary_id": "ingress",
    "english": "Ingress",
    "translate": false,
    "translation": null,
    "definition": {
      "english": "An API object that manages external access to the services in a cluster, typically HTTP.",
      "translation": "クラスター内のServiceに対する外部からのアクセス(主にHTTP)を管理するAPIオブジェクトです。"
    },
    "translation_sample": "Ingressリソースを定義して外部HTTPトラフィックをルーティングします。"
  },
  {
    "id": "istio",
    "glossary_id": "istio",
    "english": "Istio",
    "translate": false,
    "translation": null,
    "definition": {
      "english": "An open platform (not Kubernetes-specific) that provides a uniform way to integrate microservices, manage traffic flow, enforce policies, and aggregate telemetry data.",
      "translation": "Istioは、マイクロサービスの統合やトラフィックフローの管理、ポリシーの適用、そしてテレメトリーデータの集約を行うための一様な方法を提供するオープンソースのプラットフォームです(Kubernetesに特化したものではありません)。"
    },
    "translation_sample": "Istioサービスメッシュを導入してmTLS暗号化を有効化します。"
  },
  {
    "id": "network-policy",
    "glossary_id": "network-policy",
    "english": "Network Policy",
    "translate": true,
    "translation": "ネットワークポリシー",
    "definition": {
      "english": "A specification of how groups of Pods are allowed to communicate with each other and with other network endpoints.",
      "translation": "一連のPodがPod同士やその他のネットワークエンドポイントとどのように通信することを許可されるかを定める規定。"
    },
    "translation_sample": "ネットワークポリシーを設定してPod間の不要な通信をブロックします。"
  },
  {
    "id": "proxy",
    "glossary_id": "proxy",
    "english": "Proxy",
    "translate": true,
    "translation": "プロキシ",
    "definition": {
      "english": "An application acting as an intermediary between clients and servers",
      "translation": "クライアントとサーバーの間を中継するアプリケーション。"
    },
    "translation_sample": "認証プロキシとKubernetes APIサーバー間では安全に設定されたTLSを使用する必要があります。",
    "notes": "The English glossary page (content/en/docs/reference/glossary/proxy.md) has no ja translation yet, so glossary_id doesn't resolve to a ja page — but this is not actually undecided: プロキシ is already the established rendering across content/ja/docs (50+ occurrences, e.g. organize-cluster-access-kubeconfig.md, hardening-guide/authentication-mechanisms.md, service.md). Keep English only for the literal enum value `\"Proxy\"` (as in `.status.loadBalancer.ingress.ipMode`) or the unrelated proper-noun feature name \"Mixed Version Proxy\" (tracked separately as `mvp`)."
  },
  {
    "id": "headless",
    "glossary_id": null,
    "english": "Headless",
    "translate": true,
    "translation": "ヘッドレス",
    "definition": {
      "english": "Describes a Service created without a cluster IP, used when direct addressing of individual Pods is needed.",
      "translation": "個々のPodへの直接アドレス指定が必要な場合に使われる、クラスターIPを持たずに作成されたServiceを指す。"
    },
    "translation_sample": "ヘッドレスServiceを使用してPodへ直接アクセスします。",
    "notes": "Kept as katakana even though \"headless\" isn't itself a resource kind name — corrected from left-as-English \"Headless\" in PR #54056 (4 instances, t-inu)."
  }
]
