[
  {
    "id": "certificate",
    "glossary_id": "certificate",
    "english": "Certificate",
    "translate": true,
    "translation": "証明書",
    "definition": {
      "english": "A cryptographically secure file used to validate access to the Kubernetes cluster.",
      "translation": "Kubernetesクラスターへのアクセスを検証するために使用される暗号化されたセキュアなファイル。"
    },
    "translation_sample": "kube-apiserverと通信するためのクライアント証明書を発行します。"
  },
  {
    "id": "jwt",
    "glossary_id": "jwt",
    "english": "JSON Web Token (JWT)",
    "translate": false,
    "translation": null,
    "definition": {
      "english": "A means of representing claims to be transferred between two parties.",
      "translation": "2つの通信主体間で送受信されるクレームを表現する手段。"
    },
    "translation_sample": "ServiceAccountトークンはJWTとして発行されます。"
  },
  {
    "id": "pod-security-policy",
    "glossary_id": "pod-security-policy",
    "english": "Pod Security Policy",
    "translate": false,
    "translation": null,
    "definition": {
      "english": "Removed API that enforced Pod security restrictions."
    },
    "translation_sample": "Pod Security Policyは非推奨となりPod Security Standardsに置き換えられました。",
    "notes": "No official Japanese glossary page for this term yet — needs review."
  },
  {
    "id": "rbac",
    "glossary_id": "rbac",
    "english": "RBAC (Role-Based Access Control)",
    "translate": false,
    "translation": null,
    "definition": {
      "english": "Manages authorization decisions, allowing admins to dynamically configure access policies through the Kubernetes API.",
      "translation": "管理者がKubernetes APIを通じてアクセスポリシーを動的に設定できるようにし、認可の判断を管理します。"
    },
    "translation_sample": "RBACロールとRoleBindingを設定してアクセス権限を制御します。"
  },
  {
    "id": "san",
    "glossary_id": "san",
    "english": "Subject Alternative Name",
    "translate": false,
    "translation": null,
    "definition": {
      "english": "An X.509 certificate extension to identify what hostname or IP address the certificate applies to."
    },
    "translation_sample": "証明書のSubject Alternative NameにクラスターIPを含めます。",
    "notes": "No official Japanese glossary page for this term yet — needs review."
  },
  {
    "id": "security-context",
    "glossary_id": "security-context",
    "english": "Security Context",
    "translate": false,
    "translation": null,
    "definition": {
      "english": "The securityContext field defines privilege and access control settings for a Pod or container.",
      "translation": "`securityContext`フィールドは、Podまたはコンテナの権限とアクセス制御の設定を定義します。"
    },
    "translation_sample": "securityContextを設定して非rootユーザーでの実行を強制します。"
  },
  {
    "id": "signer-name",
    "glossary_id": null,
    "english": "signer name",
    "translate": true,
    "translation": "署名者名",
    "definition": {
      "english": "A domain-namespaced identifier (the spec.signerName field) that a CertificateSigningRequest or Pod certificate is addressed to, identifying which signer should issue the certificate.",
      "translation": "CertificateSigningRequestやPod証明書がどの署名者に対して発行を要求しているかを示す、ドメイン名前空間形式の識別子(spec.signerNameフィールド)。"
    },
    "translation_sample": "開発者または管理者は署名者名を選択し、対応するコントローラーをデプロイします。",
    "notes": "No official Japanese glossary page for this term yet — needs review. No prior ja translation precedent found before kubernetes-v1-37-release; カタカナ「サイナーネーム」は前例のない造語なので避けた。"
  },
  {
    "id": "signer-controller",
    "glossary_id": null,
    "english": "signer controller",
    "translate": false,
    "translation": null,
    "definition": {
      "english": "A controller that watches CertificateSigningRequest/PodCertificateRequest objects for a given signer name and issues/refreshes certificates for eligible Pods.",
      "translation": "特定の署名者名に対するCertificateSigningRequest/PodCertificateRequestオブジェクトを監視し、対象Podの証明書を発行・更新するコントローラー。"
    },
    "translation_sample": "署名者は_signer controller_をデプロイして、対象となるPodに証明書を発行させます。",
    "notes": "Undecided — kept as an English loanword (italicized \"_signer controller_\") in index.md for kubernetes-v1-37-release, but a previous translator (b1gb4by) fully translated it as 署名者コントローラー in the same document. No glossary page exists for this term. Needs a team decision before either choice is treated as settled."
  },
  {
    "id": "trust-anchor",
    "glossary_id": null,
    "english": "trust anchor",
    "translate": true,
    "translation": "トラストアンカー",
    "definition": {
      "english": "The root of trust (e.g. a CA certificate or certificate bundle) used to verify a chain of trust to other certificates.",
      "translation": "他の証明書の信頼チェーンを検証するために使われる、信頼の起点となるCA証明書や証明書バンドル。"
    },
    "translation_sample": "ClusterTrustBundleはX.509トラストアンカーをクラスターワークロードに配布します。",
    "notes": "No official Japanese glossary page for this term yet — needs review. Katakana rendering is already established precedent (content/ja/blog/_posts/2025/kubernetes-v1-33-release/index.md)."
  },
  {
    "id": "claim",
    "glossary_id": null,
    "english": "Claim",
    "aliases": [
      "claims"
    ],
    "translate": true,
    "translation": "クレーム",
    "definition": {
      "english": "A piece of information asserted about a subject, as a JWT payload field.",
      "translation": "JWTのペイロード内で主体について主張される情報の一片。"
    },
    "translation_sample": "JWTのクレームにサービスアカウント名を含めます。",
    "notes": "JWT-specific sense only — established reviewer precedent (PR #48886, t-inu) to keep クレーム rather than translate literally as 要求/請求/主張, which read as unrelated everyday meanings (complaint, request, claim-for-payment) and don't help comprehension. This was a reviewer decision on a new term, not a correction of an existing mistranslation."
  },
  {
    "id": "userns",
    "glossary_id": "userns",
    "english": "user namespace",
    "translate": true,
    "translation": "ユーザー名前空間",
    "definition": {
      "english": "A Linux kernel feature to emulate superuser privilege for unprivileged users.",
      "translation": "非特権ユーザーに対して管理者権限をエミュレートするLinuxカーネルの機能。"
    },
    "translation_sample": "ユーザー名前空間を有効化してホストとコンテナのUIDを分離します。"
  },
  {
    "id": "private-key",
    "glossary_id": null,
    "english": "Private key",
    "aliases": [
      "private-key",
      "private keys"
    ],
    "translate": true,
    "translation": "秘密鍵",
    "definition": {
      "english": "The secret half of a public/private key pair, used to sign or decrypt data.",
      "translation": "公開鍵と対をなす、署名や復号に使われる非公開の鍵。"
    },
    "translation_sample": "サービスアカウントトークン発行者の現在の秘密鍵を含むファイルのパスを指定します。",
    "notes": "Established across multiple independent files (configure-service-account.md, kubeadm-certs.md, best-practices/certificates.md, high-availability.md). Its counterpart \"public key\" -> 公開鍵 recurs alongside it constantly (e.g. \"公開鍵/秘密鍵のペア\") but isn't a separate word-list entry yet."
  }
]
