[
  {
    "id": "replicationcontroller",
    "glossary_id": "replication-controller",
    "english": "ReplicationController",
    "translate": true,
    "translation": "레플리케이션컨트롤러(ReplicationController)",
    "definition": {
      "english": "A (deprecated) API object that manages a replicated application.",
      "translation": "(사용 중단된) 복제된 애플리케이션을 관리하는 API 오브젝트"
    },
    "translation_sample": "컨트롤 플레인은 일부 파드에 장애가 발생하거나, 수동으로 파드를 삭제하거나, 실수로 너무 많은 수의 파드가 시작된 경우에도 정의된 수량의 파드가 실행되도록 한다.",
    "notes": "API 오브젝트인 경우"
  }
]
